{
  "id": "bridge:continuum-anomaly-to-lattice-no-go",
  "type": "bridge",
  "title": "Continuum Anomaly To Lattice No-Go",
  "summary": "The continuum fact that a lone anomalous fermion carries a half-level parity-anomaly response and boundary mode motivates the lattice theorem that a globally consistent band structure cannot realize unmatched net chirality; the current KB now makes that motivation precise while also making explicit why it is not the lattice proof itself.",
  "domain": "topological-phases-of-matter",
  "subdomain": "bridge-objects",
  "tags": [
    "bridge",
    "anomaly",
    "nielsen-ninomiya"
  ],
  "aliases": [],
  "assumptions": [
    "Continuum anomaly intuition is being used as motivation, not as the full proof.",
    "The rigorous compact-BZ proof route is now explicit locally through Friedan's spectral-bundle formulation."
  ],
  "regime": "Conceptual bridge between relativistic field theory and lattice band theory.",
  "scope": "Lecture One motivation for the Nielsen-Ninomiya theorem.",
  "dependencies": [
    "concept:nielsen-ninomiya-theorem",
    "claim:lattice-weyl-nodes-sum-to-zero-net-chirality",
    "theorem:half-level-cs-term-from-massive-dirac-fermion",
    "derivation_step:boundary-dirac-mode-from-negative-bulk-mass",
    "proof_fragment:continuum-parity-anomaly-does-not-establish-lattice-charge-cancellation"
  ],
  "related_units": [
    "warning:local-weyl-description-does-not-fix-global-lattice-consistency",
    "open_gap:parity-anomaly-motivates-but-does-not-prove-lattice-no-go",
    "conflict_record:continuum-parity-anomaly-is-not-lattice-no-go",
    "theorem_family:weyl-node-no-go-consistency"
  ],
  "source_anchors": [
    {
      "source_id": "paper:witten-topological-phases-1510.07698v2",
      "section": "lecture-one/the-nielsen-ninomiya-theorem",
      "notes": "Lecture One explicitly motivates the lattice theorem from the chiral anomaly problem."
    },
    {
      "source_id": "paper:friedan-proof-of-the-nielsen-ninomiya-theorem-1982",
      "section": "paper/chern-character-and-cobordism",
      "equation_labels": [
        "cobordism-chern-number-zero"
      ],
      "notes": "The actual theorem proof route is the vanishing boundary Chern number of the spectral bundle."
    }
  ],
  "formalization_status": "candidate",
  "validation_status": "cross-checked",
  "maturity": "working",
  "representation": "Motivational bridge from field-theory inconsistency to lattice topological constraint, with the proof-versus-motivation boundary now explicit.",
  "equation_refs": [],
  "quantity_refs": [],
  "failure_modes": [
    "Motivation from anomaly does not replace the actual band-topology proof."
  ],
  "formal_targets": [
    "aitp-l2"
  ],
  "retrieval_hints": [
    "Use when connecting relativistic anomaly language to condensed-matter no-go results."
  ],
  "created_at": "2026-03-16",
  "updated_at": "2026-03-21"
}
