{
  "id": "bridge:bulk-boundary-correspondence-to-fermi-arc",
  "type": "bridge",
  "title": "Bulk-Boundary Correspondence To Fermi Arc",
  "summary": "The same bulk topology that assigns charges to Weyl nodes reorganizes boundary spectra into open Fermi arcs, so the arc is a boundary projection of changing bulk topological data.",
  "domain": "topological-phases-of-matter",
  "subdomain": "bridge-objects",
  "tags": [
    "bridge",
    "bulk-boundary",
    "fermi-arc"
  ],
  "aliases": [],
  "assumptions": [
    "A boundary geometry is chosen.",
    "Bulk Weyl nodes are the relevant low-energy topological defects."
  ],
  "regime": "Boundary manifestation of bulk Weyl-node topology.",
  "scope": "Lecture One bridge from bulk node charge to surface Fermi arcs.",
  "dependencies": [
    "concept:weyl-node",
    "concept:fermi-arc"
  ],
  "related_units": [
    "claim:fermi-arcs-terminate-at-projected-weyl-nodes"
  ],
  "source_anchors": [
    {
      "source_id": "paper:witten-topological-phases-1510.07698v2",
      "section": "lecture-one/weyl-fermions-and-fermi-arcs",
      "notes": "Lecture One treats Fermi arcs as the boundary face of the bulk Weyl-node story."
    },
    {
      "source_id": "paper:witten-topological-phases-1510.07698v2",
      "section": "lecture-one/gapless-boundary-modes-from-dirac-fermions",
      "notes": "Boundary-mode intuition supports the bridge to surface spectra."
    }
  ],
  "formalization_status": "not_started",
  "validation_status": "source-grounded",
  "maturity": "seed",
  "representation": "Bridge from bulk node topology to surface spectral structure.",
  "equation_refs": [],
  "quantity_refs": [],
  "failure_modes": [
    "Boundary disorder or coincident node projections can complicate the visible arc structure."
  ],
  "formal_targets": [
    "aitp-l2"
  ],
  "retrieval_hints": [
    "Use for bulk-boundary questions in Weyl semimetals."
  ],
  "created_at": "2026-03-16",
  "updated_at": "2026-03-16"
}
