{
  "id": "concept:weyl-node",
  "type": "concept",
  "title": "Weyl Node",
  "summary": "A Weyl node is an isolated three-dimensional two-band crossing whose linearized Hamiltonian is a Weyl Hamiltonian and whose local topological charge is nonzero.",
  "domain": "topological-phases-of-matter",
  "subdomain": "weyl-semimetals",
  "tags": [
    "weyl-semimetal",
    "band-crossing",
    "chirality"
  ],
  "aliases": [
    "Weyl point",
    "Weyl crossing"
  ],
  "assumptions": [
    "The crossing is isolated in three-dimensional momentum space.",
    "A two-band local reduction is valid near the node."
  ],
  "regime": "Low-energy expansion near an isolated 3D crossing.",
  "scope": "Lecture One treatment of local two-band crossings and their topological charge.",
  "dependencies": [
    "concept:band-crossing",
    "equation:two-band-hamiltonian-d-dot-sigma",
    "quantity:chirality-sign"
  ],
  "related_units": [
    "concept:chirality-of-weyl-node",
    "concept:berry-curvature",
    "bridge:weyl-node-to-berry-monopole",
    "warning:local-weyl-description-does-not-fix-global-lattice-consistency"
  ],
  "source_anchors": [
    {
      "source_id": "paper:witten-topological-phases-1510.07698v2",
      "section": "lecture-one/three-dimensions",
      "equation_labels": [
        "xpa",
        "perd"
      ],
      "notes": "The local 2x2 Hamiltonian determines the Weyl cone and its handedness."
    }
  ],
  "formalization_status": "not_started",
  "validation_status": "source-grounded",
  "maturity": "seed",
  "symmetries": [
    "Crystal translation symmetry is implicit."
  ],
  "representation": "Local 2x2 Bloch Hamiltonian with linearized Pauli-matrix coefficients.",
  "model_refs": [
    "model:two-band-lattice-weyl-model"
  ],
  "equation_refs": [
    "equation:two-band-hamiltonian-d-dot-sigma",
    "equation:berry-flux-topological-charge"
  ],
  "quantity_refs": [
    "quantity:chirality-sign",
    "quantity:winding-number"
  ],
  "failure_modes": [
    "If the determinant of the linearization vanishes, the simple Weyl description can fail.",
    "Global lattice consistency is not fixed by the local cone alone."
  ],
  "formal_targets": [
    "aitp-l2",
    "lean"
  ],
  "retrieval_hints": [
    "Primary entry point for Weyl semimetal queries."
  ],
  "created_at": "2026-03-16",
  "updated_at": "2026-03-16"
}
