{
  "id": "claim:isolated-3d-two-band-crossings-are-weyl-nodes",
  "type": "claim",
  "title": "Isolated 3D Two-Band Crossings Are Weyl Nodes",
  "summary": "A generic isolated two-band crossing in three dimensions linearizes to a Weyl Hamiltonian, with chirality given by the sign of the Jacobian determinant.",
  "domain": "topological-phases-of-matter",
  "subdomain": "weyl-semimetals",
  "tags": [
    "weyl-node",
    "genericity",
    "3d-crossing"
  ],
  "aliases": [],
  "assumptions": [
    "The crossing is simple and isolated.",
    "A local two-band reduction is valid."
  ],
  "regime": "Low-energy 3D crossing analysis.",
  "scope": "Lecture One codimension-counting and linearization result.",
  "dependencies": [
    "concept:band-crossing",
    "concept:weyl-node",
    "quantity:chirality-sign"
  ],
  "related_units": [
    "claim:generic-2d-dirac-points-require-symmetry-protection"
  ],
  "source_anchors": [
    {
      "source_id": "paper:witten-topological-phases-1510.07698v2",
      "section": "lecture-one/three-dimensions",
      "equation_labels": [
        "xpa",
        "perd"
      ],
      "notes": "The local Hamiltonian is identified with a Weyl Hamiltonian."
    }
  ],
  "formalization_status": "not_started",
  "validation_status": "source-grounded",
  "maturity": "working",
  "representation": "Genericity claim about isolated 3D two-band crossings.",
  "model_refs": [
    "model:two-band-lattice-weyl-model"
  ],
  "equation_refs": [
    "equation:two-band-hamiltonian-d-dot-sigma"
  ],
  "quantity_refs": [
    "quantity:chirality-sign"
  ],
  "failure_modes": [
    "If the determinant vanishes or additional symmetries impose higher-order touching, the simple Weyl story can fail."
  ],
  "formal_targets": [
    "aitp-l2",
    "lean"
  ],
  "retrieval_hints": [
    "Use for the local identification of a 3D crossing as a Weyl point."
  ],
  "created_at": "2026-03-16",
  "updated_at": "2026-03-16"
}
