{
  "id": "derivation:linearization-gives-1d-chiral-mode",
  "type": "derivation",
  "title": "Linearization Gives A 1D Chiral Mode",
  "summary": "Linearizing the dispersion around a one-dimensional Fermi crossing and replacing momentum deviation by -i d/dx yields a continuum chiral Hamiltonian whose sign of velocity fixes the branch direction.",
  "domain": "topological-phases-of-matter",
  "subdomain": "lecture-one",
  "tags": [
    "derivation",
    "linearization",
    "1d-chiral-mode"
  ],
  "aliases": [],
  "assumptions": [
    "The crossing is simple with nonzero slope.",
    "Long-wavelength continuum approximation is valid."
  ],
  "regime": "One-dimensional low-energy effective theory.",
  "scope": "Lecture One derivation from local band data to chiral continuum field theory.",
  "dependencies": [
    "equation:linearized-dispersion-near-fermi-point",
    "equation:continuum-1d-chiral-fermion-hamiltonian",
    "quantity:fermi-velocity"
  ],
  "related_units": [
    "warning:local-weyl-description-does-not-fix-global-lattice-consistency"
  ],
  "source_anchors": [
    {
      "source_id": "paper:witten-topological-phases-1510.07698v2",
      "section": "lecture-one/relativistic-dispersion-in-one-space-dimension",
      "equation_labels": [
        "dolz",
        "continuum"
      ],
      "notes": "This is the first continuum reduction in Lecture One."
    }
  ],
  "formalization_status": "not_started",
  "validation_status": "source-grounded",
  "maturity": "working",
  "representation": "Low-energy derivation from Taylor expansion plus momentum-to-derivative substitution.",
  "equation_refs": [
    "equation:linearized-dispersion-near-fermi-point",
    "equation:continuum-1d-chiral-fermion-hamiltonian"
  ],
  "quantity_refs": [
    "quantity:fermi-velocity"
  ],
  "failure_modes": [
    "A single chiral branch is only a local low-energy description, not a global lattice theory."
  ],
  "formal_targets": [
    "aitp-l2"
  ],
  "retrieval_hints": [
    "Use when a query asks how a band crossing becomes a relativistic chiral mode."
  ],
  "created_at": "2026-03-16",
  "updated_at": "2026-03-16"
}
