{
  "id": "concept:complex-line-bundle-of-filled-states",
  "type": "concept",
  "title": "Complex Line Bundle Of Filled States",
  "summary": "For a two-band system with one filled band, the occupied state at each regular momentum defines a one-dimensional complex vector space; together these fibers form the line bundle on which the Berry connection lives.",
  "domain": "topological-phases-of-matter",
  "subdomain": "berry-geometry",
  "tags": [
    "line-bundle",
    "filled-bands",
    "berry-geometry"
  ],
  "aliases": [
    "occupied-state bundle"
  ],
  "assumptions": [
    "Exactly one band is filled in the local two-band discussion.",
    "Bad points are removed from the base space."
  ],
  "regime": "Punctured regular momentum space B'.",
  "scope": "Lecture One geometric reformulation of the occupied-state phase problem.",
  "dependencies": [],
  "related_units": [
    "concept:berry-connection",
    "concept:berry-curvature"
  ],
  "source_anchors": [
    {
      "source_id": "paper:witten-topological-phases-1510.07698v2",
      "section": "lecture-one/the-berry-connection",
      "notes": "The line-bundle picture underlies the Berry connection construction."
    }
  ],
  "formalization_status": "not_started",
  "validation_status": "source-grounded",
  "maturity": "seed",
  "symmetries": [
    "U(1) phase redundancy in local eigenvector choices."
  ],
  "representation": "Rank-one complex vector bundle over regular momentum space.",
  "model_refs": [],
  "equation_refs": [
    "equation:berry-flux-topological-charge"
  ],
  "quantity_refs": [
    "quantity:berry-curvature-two-form"
  ],
  "failure_modes": [
    "For multiple filled bands the geometry becomes non-abelian rather than a line bundle."
  ],
  "formal_targets": [
    "aitp-l2",
    "lean"
  ],
  "retrieval_hints": [
    "Use for geometric explanations of Berry phase and curvature."
  ],
  "created_at": "2026-03-16",
  "updated_at": "2026-03-16"
}
