{
  "id": "claim:lattice-weyl-nodes-sum-to-zero-net-chirality",
  "type": "claim",
  "title": "Lattice Weyl Nodes Sum To Zero Net Chirality",
  "summary": "In a lattice system with isolated Weyl nodes, the total chirality over the Brillouin zone vanishes; positive and negative nodes must balance globally.",
  "domain": "topological-phases-of-matter",
  "subdomain": "lattice-topology",
  "tags": [
    "nielsen-ninomiya",
    "fermion-doubling",
    "chirality-cancellation"
  ],
  "aliases": [],
  "assumptions": [
    "The Brillouin zone is compact.",
    "All bad points are isolated."
  ],
  "regime": "Lattice band theory with isolated point nodes.",
  "scope": "Lecture One theorem-level statement for Weyl-node sets.",
  "dependencies": [
    "concept:nielsen-ninomiya-theorem",
    "quantity:chirality-sign",
    "quantity:winding-number"
  ],
  "related_units": [
    "warning:local-weyl-description-does-not-fix-global-lattice-consistency",
    "bridge:continuum-anomaly-to-lattice-no-go"
  ],
  "source_anchors": [
    {
      "source_id": "paper:witten-topological-phases-1510.07698v2",
      "section": "lecture-one/the-nielsen-ninomiya-theorem",
      "equation_labels": [
        "cl"
      ],
      "notes": "The global sum of the node charges is zero."
    },
    {
      "source_id": "paper:witten-topological-phases-1510.07698v2",
      "section": "lecture-one/the-berry-connection",
      "equation_labels": [
        "nna"
      ],
      "notes": "The same cancellation is recovered from the Berry-curvature formulation."
    }
  ],
  "formalization_status": "not_started",
  "validation_status": "source-grounded",
  "maturity": "working",
  "representation": "Global theorem-style statement about the node set.",
  "model_refs": [
    "model:two-band-lattice-weyl-model"
  ],
  "equation_refs": [
    "equation:winding-number-as-s2-to-s2-degree",
    "equation:berry-flux-topological-charge"
  ],
  "quantity_refs": [
    "quantity:chirality-sign",
    "quantity:winding-number"
  ],
  "failure_modes": [
    "A local continuum Weyl cone does not imply this claim by itself."
  ],
  "formal_targets": [
    "aitp-l2",
    "lean"
  ],
  "retrieval_hints": [
    "Use for queries about why net chirality cannot be nonzero on a lattice."
  ],
  "created_at": "2026-03-16",
  "updated_at": "2026-03-16"
}
