{
  "id": "concept:dirac-point-in-2d",
  "type": "concept",
  "title": "Dirac Point In Two Dimensions",
  "summary": "A two-dimensional Dirac point is a linear band crossing in 2D whose generic persistence usually requires extra symmetry or special tuning rather than only codimension counting.",
  "domain": "topological-phases-of-matter",
  "subdomain": "dirac-materials",
  "tags": [
    "dirac-point",
    "2d-materials",
    "symmetry-protection"
  ],
  "aliases": [],
  "assumptions": [
    "The problem is two-dimensional.",
    "The crossing is analyzed near the Fermi level."
  ],
  "regime": "Two-dimensional Bloch-band systems.",
  "scope": "Lecture One discussion of why 2D crossings are less generic than 3D Weyl crossings.",
  "dependencies": [
    "concept:band-crossing"
  ],
  "related_units": [
    "claim:generic-2d-dirac-points-require-symmetry-protection",
    "warning:crossing-away-from-fermi-energy-is-not-yet-a-clean-weyl-semimetal"
  ],
  "source_anchors": [
    {
      "source_id": "paper:witten-topological-phases-1510.07698v2",
      "section": "lecture-one/two-dimensions",
      "equation_labels": [
        "twod"
      ],
      "notes": "Lecture One contrasts the 2D and 3D genericity stories."
    }
  ],
  "formalization_status": "not_started",
  "validation_status": "source-grounded",
  "maturity": "seed",
  "symmetries": [
    "Often requires lattice or antiunitary symmetry input."
  ],
  "representation": "Two-dimensional linearized crossing of valence and conduction bands.",
  "model_refs": [],
  "equation_refs": [],
  "quantity_refs": [
    "quantity:fermi-energy"
  ],
  "failure_modes": [
    "Without symmetry protection, a small perturbation often gaps the crossing."
  ],
  "formal_targets": [
    "aitp-l2"
  ],
  "retrieval_hints": [
    "Use for symmetry-protected Dirac-point questions in two dimensions."
  ],
  "created_at": "2026-03-16",
  "updated_at": "2026-03-16"
}
