{
  "id": "quantity:fermi-velocity",
  "type": "quantity",
  "title": "Fermi Velocity",
  "summary": "The Fermi velocity is the slope of the dispersion at a crossing and acts as the effective light-cone speed in the linearized continuum description.",
  "domain": "topological-phases-of-matter",
  "subdomain": "low-energy-kinematics",
  "tags": [
    "velocity",
    "linearization",
    "fermi-surface"
  ],
  "aliases": [
    "group velocity at the crossing"
  ],
  "assumptions": [
    "The dispersion is differentiable at the crossing."
  ],
  "regime": "Low-energy analysis near a Fermi point.",
  "scope": "Lecture One one-dimensional linearization and its relativistic analogy.",
  "dependencies": [],
  "related_units": [
    "equation:linearized-dispersion-near-fermi-point",
    "equation:continuum-1d-chiral-fermion-hamiltonian"
  ],
  "source_anchors": [
    {
      "source_id": "paper:witten-topological-phases-1510.07698v2",
      "section": "lecture-one/relativistic-dispersion-in-one-space-dimension",
      "equation_labels": [
        "dolz"
      ],
      "notes": "Defined as the derivative of epsilon with respect to momentum at p0."
    }
  ],
  "formalization_status": "not_started",
  "validation_status": "source-grounded",
  "maturity": "stable",
  "representation": "Slope of the energy-momentum relation at the crossing.",
  "quantity_refs": [],
  "symbols": [
    {
      "symbol": "v",
      "meaning": "Fermi velocity"
    }
  ],
  "failure_modes": [
    "Vanishing slope invalidates the simple chiral continuum description."
  ],
  "formal_targets": [
    "aitp-l2"
  ],
  "retrieval_hints": [
    "Use for the relativistic-form interpretation of a linearized band crossing."
  ],
  "created_at": "2026-03-16",
  "updated_at": "2026-03-16"
}
