{
  "id": "concept:fermi-arc",
  "type": "concept",
  "title": "Fermi Arc",
  "summary": "A Fermi arc is a surface-state locus in boundary momentum space whose endpoints lie at the projections of bulk Weyl nodes of opposite total charge.",
  "domain": "topological-phases-of-matter",
  "subdomain": "boundary-phenomena",
  "tags": [
    "fermi-arc",
    "boundary-mode",
    "weyl-semimetal"
  ],
  "aliases": [],
  "assumptions": [
    "A boundary geometry is specified.",
    "Bulk Weyl nodes project to distinct boundary momenta."
  ],
  "regime": "Boundary spectrum of a Weyl semimetal.",
  "scope": "Lecture One surface-state discussion connected to bulk Weyl nodes.",
  "dependencies": [
    "concept:weyl-node"
  ],
  "related_units": [
    "claim:fermi-arcs-terminate-at-projected-weyl-nodes",
    "bridge:bulk-boundary-correspondence-to-fermi-arc"
  ],
  "source_anchors": [
    {
      "source_id": "paper:witten-topological-phases-1510.07698v2",
      "section": "lecture-one/weyl-fermions-and-fermi-arcs",
      "notes": "Lecture One introduces Fermi arcs as a boundary signature of bulk Weyl topology."
    }
  ],
  "formalization_status": "not_started",
  "validation_status": "source-grounded",
  "maturity": "seed",
  "symmetries": [],
  "representation": "Boundary-state locus in the surface Brillouin zone.",
  "model_refs": [
    "model:two-band-lattice-weyl-model"
  ],
  "equation_refs": [],
  "quantity_refs": [],
  "failure_modes": [
    "If projected nodes coincide, the arc picture can reorganize."
  ],
  "formal_targets": [
    "aitp-l2"
  ],
  "retrieval_hints": [
    "Use when a query asks how Weyl bulk topology appears at a boundary."
  ],
  "created_at": "2026-03-16",
  "updated_at": "2026-03-16"
}
