{
  "id": "method:berry-flux-diagnosis-of-node-charge",
  "type": "method",
  "title": "Berry-Flux Diagnosis Of Node Charge",
  "summary": "To determine the charge of an isolated Weyl node, surround it by a small sphere in momentum space, compute the Berry curvature of the occupied state, and integrate the flux over the sphere.",
  "domain": "topological-phases-of-matter",
  "subdomain": "diagnostics",
  "tags": [
    "method",
    "berry-flux",
    "weyl-node"
  ],
  "aliases": [],
  "assumptions": [
    "A local occupied-state bundle can be constructed on the surrounding sphere."
  ],
  "regime": "Local diagnostic for an isolated point node.",
  "scope": "Operational procedure distilled from Lecture One.",
  "dependencies": [
    "concept:berry-curvature",
    "equation:berry-flux-topological-charge",
    "quantity:winding-number"
  ],
  "related_units": [
    "derivation:berry-flux-gives-node-charge",
    "bridge:weyl-node-to-berry-monopole"
  ],
  "source_anchors": [
    {
      "source_id": "paper:witten-topological-phases-1510.07698v2",
      "section": "lecture-one/the-berry-connection",
      "equation_labels": [
        "zif"
      ],
      "notes": "Lecture One states the flux rule explicitly."
    }
  ],
  "formalization_status": "not_started",
  "validation_status": "source-grounded",
  "maturity": "working",
  "representation": "Local computational diagnostic using curvature flux.",
  "equation_refs": [
    "equation:berry-flux-topological-charge"
  ],
  "quantity_refs": [
    "quantity:berry-curvature-two-form",
    "quantity:winding-number"
  ],
  "failure_modes": [
    "The method must be modified for non-abelian occupied subspaces."
  ],
  "formal_targets": [
    "aitp-l2"
  ],
  "retrieval_hints": [
    "Use as an explicit procedure rather than only a conceptual statement."
  ],
  "created_at": "2026-03-16",
  "updated_at": "2026-03-16"
}
