{
  "id": "quantity:chirality-sign",
  "type": "quantity",
  "title": "Chirality Sign",
  "summary": "The chirality sign is the plus or minus label attached to a Weyl node by the sign of the Jacobian determinant of the local linearized map.",
  "domain": "topological-phases-of-matter",
  "subdomain": "weyl-semimetals",
  "tags": [
    "chirality",
    "sign",
    "weyl-node"
  ],
  "aliases": [
    "handedness sign"
  ],
  "assumptions": [
    "An orientation convention has been fixed."
  ],
  "regime": "Local Weyl-node analysis.",
  "scope": "Lecture One sign data for isolated linear Weyl crossings.",
  "dependencies": [],
  "related_units": [
    "concept:chirality-of-weyl-node",
    "claim:lattice-weyl-nodes-sum-to-zero-net-chirality"
  ],
  "source_anchors": [
    {
      "source_id": "paper:witten-topological-phases-1510.07698v2",
      "section": "lecture-one/three-dimensions",
      "equation_labels": [
        "perd"
      ],
      "notes": "The determinant sign is the chirality label."
    }
  ],
  "formalization_status": "not_started",
  "validation_status": "source-grounded",
  "maturity": "stable",
  "representation": "Sign of the local Jacobian determinant.",
  "symbols": [
    {
      "symbol": "sign det(b_ij)",
      "meaning": "chirality sign of the Weyl node"
    }
  ],
  "failure_modes": [
    "Sign conventions can differ between references."
  ],
  "formal_targets": [
    "aitp-l2",
    "lean"
  ],
  "retrieval_hints": [
    "Use when a query asks what plus or minus Weyl chirality means."
  ],
  "created_at": "2026-03-16",
  "updated_at": "2026-03-16"
}
