{
  "id": "warning:crossing-away-from-fermi-energy-is-not-yet-a-clean-weyl-semimetal",
  "type": "warning",
  "title": "Crossing Away From The Fermi Energy Is Not Yet A Clean Weyl Semimetal",
  "summary": "A topological crossing can exist in a band structure without controlling the low-energy physics; to identify a clean Weyl semimetal, the crossing must be relevant near the Fermi energy.",
  "domain": "topological-phases-of-matter",
  "subdomain": "low-energy-kinematics",
  "tags": [
    "warning",
    "fermi-energy",
    "weyl-semimetal"
  ],
  "aliases": [],
  "assumptions": [
    "Material or model filling is part of the physical question."
  ],
  "regime": "Band structures with crossings that may or may not sit near the chemical potential.",
  "scope": "Lecture One distinction between formal crossings and low-energy semimetal phases.",
  "dependencies": [
    "concept:band-crossing",
    "quantity:fermi-energy"
  ],
  "related_units": [
    "concept:fermi-arc",
    "claim:fermi-arcs-terminate-at-projected-weyl-nodes"
  ],
  "source_anchors": [
    {
      "source_id": "paper:witten-topological-phases-1510.07698v2",
      "section": "lecture-one/band-crossing-at-the-fermi-energy",
      "notes": "Lecture One explicitly distinguishes a formal crossing from a physically active low-energy semimetal."
    }
  ],
  "formalization_status": "not_started",
  "validation_status": "source-grounded",
  "maturity": "working",
  "representation": "Scope warning about physical relevance at the chosen filling.",
  "equation_refs": [],
  "quantity_refs": [
    "quantity:fermi-energy"
  ],
  "failure_modes": [
    "Ignoring filling can lead to overstating the phase realized by a model or material."
  ],
  "formal_targets": [
    "aitp-l2"
  ],
  "retrieval_hints": [
    "Return this whenever a band crossing is discussed without specifying its location relative to the Fermi energy."
  ],
  "created_at": "2026-03-16",
  "updated_at": "2026-03-16"
}
