{
  "id": "quantity:winding-number",
  "type": "quantity",
  "title": "Winding Number",
  "summary": "The winding number is the integer degree assigned to an isolated bad point by the normalized map from an enclosing sphere in momentum space to the target sphere.",
  "domain": "topological-phases-of-matter",
  "subdomain": "topological-charge",
  "tags": [
    "integer-invariant",
    "degree",
    "weyl-semimetal"
  ],
  "aliases": [
    "topological charge"
  ],
  "assumptions": [
    "The enclosing surface avoids other singularities."
  ],
  "regime": "Topological classification of isolated point nodes.",
  "scope": "Lecture One point-node charge in degree and Berry-flux language.",
  "dependencies": [],
  "related_units": [
    "equation:winding-number-as-s2-to-s2-degree",
    "equation:berry-flux-topological-charge",
    "concept:nielsen-ninomiya-theorem"
  ],
  "source_anchors": [
    {
      "source_id": "paper:witten-topological-phases-1510.07698v2",
      "section": "lecture-one/the-nielsen-ninomiya-theorem",
      "equation_labels": [
        "wn",
        "nwn",
        "wnn"
      ],
      "notes": "The same integer appears as a degree and as a flux."
    }
  ],
  "formalization_status": "not_started",
  "validation_status": "source-grounded",
  "maturity": "stable",
  "representation": "Integer-valued invariant attached to an isolated point node.",
  "symbols": [
    {
      "symbol": "w",
      "meaning": "integer winding number / node charge"
    }
  ],
  "failure_modes": [
    "If the enclosed region contains multiple nodes, the value is only the total charge."
  ],
  "formal_targets": [
    "aitp-l2",
    "lean"
  ],
  "retrieval_hints": [
    "Use for questions about node charge, degree, or chirality summation."
  ],
  "created_at": "2026-03-16",
  "updated_at": "2026-03-16"
}
